<?xml version="1.0" encoding="UTF-8"?>

<Obavestenje xmlns="http://www.ftn.uns.ac.rs/obavestenjecir"
    xmlns:xsi="http://www.w3.org/2001/XMLSchema-instance"
    xsi:schemaLocation="http://www.ftn.uns.ac.rs/obavestenjecir ../xsd_documents/obavestenjecir.xsd"
    xmlns:pred="http://www.ftn.uns.ac.rs/rdf/examples/predicate/">
    <Osnovni_podaci>
        <Organ>
            <Naziv property="pred:nazivOrgana" datatype="xs:string">Naziv organa</Naziv>
            <Sediste property="pred:sedisteOrgana" datatype="xs:string">Kikinda</Sediste>
        </Organ>
        <Broj_predmeta>5</Broj_predmeta>
        <Datum property="pred:datum" datatype="xs:date">2021-01-02</Datum>
        <Podnosioc_zahteva>
            <Ime property="pred:imePodnosioca" datatype="xs:string">Marija</Ime>
            <Prezime property="pred:prezimePodnosioca" datatype="xs:string">Curcic</Prezime>
            <Naziv>Naziv 2</Naziv>
            <Adresa property="pred:adresaPodnosioca" datatype="xs:string">Teodora Drajzera</Adresa>
        </Podnosioc_zahteva>
    </Osnovni_podaci>
    
    <Sadrzaj>
        <Naslov>O B A V E S T E N J E 2</Naslov>
        <Podnaslov>о стављању на увид документа који садржи
            тражену информацију и о изради копије
        </Podnaslov>

        <Paragraf>
            Paragraf za Obavestenje 2
            <Godina>2021</Godina> год., којим сте тражили увид у документ/е са информацијама о / у вези са: 
            <Opis_informacije>...opis...</Opis_informacije>
            обавештавамо вас да дана <Datum_uvida>2020-01-03</Datum_uvida>, u <Vreme_uvida>13:00:00</Vreme_uvida> часова, односно у времену од <Pocetak_cas>15:00:00</Pocetak_cas> do 
            <Kraj_cas>16:20:00</Kraj_cas> часова, у просторијама органа у <Grad_organa>Novi Sad</Grad_organa> ул. <Ulica_organa>Misiceva</Ulica_organa> бр. 
            <Broj_organa>3</Broj_organa>, канцеларија бр. <Broj_kancelarije>12a</Broj_kancelarije> можете извршити увид у документ/е у коме је садржана 
            тражена информација.

            Том приликом, на ваш захтев, може вам се издати и копија документа са траженом информацијом.

            Трошкови су утврђени Уредбом Владе Републике Србије („Сл. гласник РС“, бр. 8/06), и то: 
            копија стране А4 формата износи 3 динара, А3 формата 6 динара, CD 35 динара, дискете 20 
            динара, DVD 40 динара, аудио-касета – 150 динара, видео-касета 300 динара, претварање 
            једне стране документа из физичког у електронски облик – 30 динара.

            Износ укупних трошкова израде копије документа по вашем захтеву износи <Iznos_troskova>500</Iznos_troskova>
            динара и уплаћује се на жиро-рачун Буџета Републике Србије бр. 840-742328-843-30, с 
            позивом на број 97 – ознака шифре општине/града где се налази орган власти (из 
            Правилника о условима и начину вођења рачуна – „Сл. гласник РС“, 20/07... 40/10).
        </Paragraf>
        
        
        <Dostavljeno Selected="2">
            <Primer ID="1">1. Именованом </Primer>
            <Primer ID="2">2. Архиви</Primer>
        </Dostavljeno>
    </Sadrzaj>
</Obavestenje>